{
  "description": "The action vocabulary's content: the instances the `actions` query scope serves. Validates against `action.schema.json#/$defs/actions_payload`, which is the metaschema and holds no instances. Derivation and cadence: representation.md sections 6 and 7.",
  "schema_version": "1.0.0",
  "actions": [
    {
      "id": "MoveTo",
      "description": "Move to a target location, carrying whatever is held.",
      "parameters": {
        "target": {
          "value": {
            "$ref": "common.schema.json#/$defs/position"
          },
          "description": "Where to go."
        }
      },
      "requires_capabilities": [
        "locomotion"
      ]
    },
    {
      "id": "Attach",
      "description": "Take custody of an element. The grasp half of the grasp/release pair.",
      "parameters": {
        "object": {
          "value": {
            "$ref": "common.schema.json#/$defs/element_id"
          },
          "description": "The element taken into custody."
        },
        "target": {
          "value": {
            "$ref": "common.schema.json#/$defs/position"
          },
          "description": "Where custody is taken. Supplied by the plan, resolved from the referenced product element."
        }
      },
      "requires_capabilities": [
        "gripper"
      ]
    },
    {
      "id": "Detach",
      "description": "Release custody of an element. The release half of the grasp/release pair.",
      "parameters": {
        "object": {
          "value": {
            "$ref": "common.schema.json#/$defs/element_id"
          },
          "description": "The element released."
        },
        "target": {
          "value": {
            "$ref": "common.schema.json#/$defs/position"
          },
          "description": "Where the element is released. Supplied by the plan, resolved from the referenced product element."
        }
      },
      "requires_capabilities": [
        "gripper"
      ]
    }
  ],
  "compounds": [
    {
      "id": "TransportComponent",
      "description": "The transport cycle: reach the element, take custody, carry it to where it belongs, release it.",
      "decomposition": [
        "MoveTo",
        "Attach",
        "MoveTo",
        "Detach"
      ]
    }
  ]
}
